278,47.208877,39.705847,МППРостов-на-ДонуЮФО,Ростовский,МПП,МПП,Ростов-на-Дону,установлен,да,да,функционирует,круглосуточно,морской,не определен,грузовой,постоянный,многосторонний,не определен,да,да,да,не применимо,не применимо,ЮФО,Ростовская область,"Ростовская область, г. Ростов-на-Дону, в пределах морского порта Ростов-на-Дону",0,0,Группа А,107,Морской,АЧБ,0,0,0,0,0,0.0,0,0,0,0,0,0.0,6019,0,0,6019,6701,0,0,6701,7526,0,0,7526,7192,0,0,7192,6354,0,0,6354,5158,0,0,5158,81253,85220,95969,90016,81143,64466,13458004.16,15128563.138,15720611.7596,18180188.2732,19139127.3072,11223221.926,да,да,да,да,да,нет,нет
279,47.488342,39.929081,ВППРостов-на-Дону (Платов)ЮФО,Ростовский,ВПП,ВПП,Ростов-на-Дону (Платов),установлен,да,нет,функционирует,круглосуточно,воздушный,не определен,грузо-пассажирский,постоянный,многосторонний,не определен,нет,да,да,не применимо,не применимо,ЮФО,Ростовская область,"Ростовская область, Аксайский район, Грушевское с.п., аэропорт",0,0,Группа С,251,Не является признаком отнесения к МТК,Не является признаком отнесения к МТК,0,0,0,0,25920,0.0,0,0,0,0,9460800,0.0,1603,2999,0,4602,110,5514,0,5624,5,4987,0,4992,377,1593,0,1970,895,3821,0,4716,5,584,0,589,653863,720394,680523,427575,630258,75573,30.796,1389.27,187.725,217.953,461.277,170.1,да,да,да,да,да,нет,нет
280,55.1583999991417,20.8500000014901,РППРыбачийСЗФО,Калининградский,РПП,РПП,Рыбачий,установлен,да,нет,"Не функционирует с 2018 года по причине необустроенности пункта пропуска. Собственник ООО ""Маггис-Трейд"" решением Арбитражного суда г. Москвы 19.07.2017 признан банкротом. Решение о целесообразности функционирования пункта пропуска не принято, в том числе сопредельным государством",на нерегулярной основе в заявительном порядке,речной,не определен,грузо-пассажирский,сезонный,многосторонний,не определен,нет,нет,нет,Литовская Республика,Нида,СЗФО,Калининградская область,"238535, Калининградская обл., Зеленоградский р-он, поселок Рыбачий",0,0,Группа С,346,Сухопутный,Западный,0,0,0,0,0,0.0,0,0,0,0,0,0.0,2,0,0,2,0,0,0,0,0,0,0,0,0,0,0,0,0,0,0,0,0,0,0,0,6,0,0,0,0,0,0.0,0.0,0.0,0.0,0.0,0.0,да,да,да,да,да,нет,Литовская Республика
281,71.279491,72.061412,ВППСабеттаУФО,Мурманский,ВПП,ВПП,Сабетта,установлен,да,нет,функционирует,"по регламенту аэропорта Сабетта, в период прибытия/убытия международных авиарейсов",воздушный,не определен,грузо-пассажирский,работающий на нерегулярной основе,многосторонний,не определен,нет,нет,нет,не применимо,не применимо,УФО,Ямало-Ненецкий автономный округ,"Российская Федерация, Ямало-Ненецкий автономный округ, п. Сабетта",0,0,Группа В,177,Не является признаком отнесения к МТК,Не является признаком отнесения к МТК,0,0,0,2,960,100.0,0,0,0,0,0,0.0,47,18,0,65,26,6,0,32,2,5,0,7,0,0,0,0,0,0,0,0,0,0,0,0,752,314,92,0,0,0,970.5754999999999,365.1504,37.8065,0.0,0.0,0.0,да,да,да,да,да,нет,нет
282,71.219395,72.047648,МППСабеттаУФО,Мурманский,МПП,МПП,Сабетта,установлен,да,нет,функционирует,круглосуточно,морской,не определен,грузовой,постоянный,многосторонний,не определен,нет,нет,нет,не применимо,не применимо,УФО,Ямало-Ненецкий автономный округ,"Ямало-Ненецкий автономный округ,  п. Сабетта",0,0,Группа В,247,Морской,Арктика,1,0,0,1,0,48904.0,365,0,0,365,0,17849960.0,145,0,0,145,307,0,0,307,608,0,0,608,582,0,0,582,584,0,0,584,598,0,0,598,2974,9741,20641,19088,19093,19388,289425.018723,9014228.154539999,19591090.504,19787024.578,20615288.70347,21181393.41,да,да,да,да,да,нет,нет
283,50.857938,56.142094,МАППСагарчинПФО,Уральский,АПП,МАПП,Сагарчин,установлен,да,да,функционирует,круглосуточно,автомобильный,не определен,грузо-пассажирский,постоянный,многосторонний,не определен,нет,нет,нет,Республика Казахстан,Жайсан,ПФО,Оренбургская область,"Оренбургская область, Акбулакский район, 160 км автомобильной дороги Оренбург - Актюбинск",федеральная,Р-239,Группа А,57,Не является признаком отнесения к МТК,Не является признаком отнесения к МТК,0,0,0,0,0,0.0,0,0,0,0,0,0.0,111831,16709,228194,356734,140395,13130,296498,450023,179528,15441,291423,486392,188482,3183,73351,265016,206518,517,43900,250935,200767,5538,194344,400649,1215430,1479209,1679878,551812,396111,1023040,0.0,0.0,0.0,0.0,0.0,0.0,да,нет,нет,нет,нет,нет,Республика Казахстан
284,66.944902,29.038847,МАППСаллаСЗФО,Мурманский,АПП,МАПП,Салла,установлен,да,нет,функционирует,"с 30.10.2022 ежедневно, пн-пт - с 09:00 до 19:00, сб-вс – с 10:00 до 18:00 (мск).
Режим работы пункта пропуска согласовывается пограничными комиссарами Российской Федерации
и Финляндской Республики на период перехода сопредельного государства с зимнего на летнее и с летнего на зимнее время:",автомобильный,не определен,грузо-пассажирский,постоянный,многосторонний,не определен,нет,нет,да,Финляндская Республика,Келлоселькя,СЗФО,Мурманская область,"Мурманская область, cельское поселение Алакуртти Кандалакшского муниципального района Мурманской области, 73 км автомобильной дороги Алакуртти – государственная граница, место: 66°57' северной широты, 29°03' восточной долготы",региональная,"47 ОП РЗ 47А-001 Автомобильная дорога Кандалакша - Алакуртти - КПП ""Салла"" (сокращенное наименование -автодорога ""Салла"")",Группа В,128,Сухопутный,Западный,0,0,0,200,600,0.0,0,0,0,73000,219000,0.0,1568,289,75968,77825,1760,186,72027,73973,1311,171,67581,69063,1510,26,13447,14983,958,0,1727,2685,161,1,6687,6849,133989,126973,120656,27301,4301,11159,20648.68,20387.18,14215.027,15533.83,10517.3,1466.02,да,да,да,нет,нет,да,Финляндская Республика
285,53.50898,50.151718,ВППСамара (Курумоч)ПФО,Волгоградский,ВПП,ВПП,Самара (Курумоч),установлен,да,нет,функционирует,круглосуточно,воздушный,не определен,грузо-пассажирский,постоянный,многосторонний,не определен,нет,да,нет,не применимо,не применимо,ПФО,Самарская область,"Самарская область, 35 км севернее г. Самара, 8 км северо-восточнее р.п. Курумоч",0,0,Группа С,180,Не является признаком отнесения к МТК,Не является признаком отнесения к МТК,4,25,0,29,17760,75.0,1460,9125,0,10585,6482400,27375.0,0,5065,0,5065,1,4976,0,4977,0,4638,0,4638,2,661,0,663,0,3715,0,3715,1,3499,0,3500,795691,818397,822894,134079,632947,478569,1320.1,170.1,161.0,59.40000000000001,2.72,19.905,да,да,да,да,да,нет,нет
286,59.955817,30.356343,ЖДППСанкт-Петербург-ФинляндскийСЗФО,Санкт-Петербургский,ЖДПП,ЖДПП,Санкт-Петербург-Финляндский,установлен,да,нет,функционирует,круглосуточно,железнодорожный,не определен,пассажирский,постоянный,многосторонний,не определен,нет,нет,нет,Финляндская Республика,Вайниккала,СЗФО,г. Санкт-Петербург,"195009, ж/д станция ""Санкт-Петербург-Финляндский"": Санкт-Петербург, пл. Ленина, д.6 лит Е. Здание административно-хозяйственное: Санкт-Петербург, ул. Боткинская, д. 1",0,0,Группа С,127,Не является признаком отнесения к МТК,Не является признаком отнесения к МТК,0,8,0,8,2920,0.0,0,2920,0,2920,1065800,0.0,0,2916,0,2916,0,2906,0,2906,0,2900,0,2900,0,616,0,616,0,99,0,99,0,343,0,343,485363,483436,554512,99023,4546,32443,0.0,0.0,0.0,0.0,0.25,0.0,да,да,да,да,да,нет,Финляндская Республика
287,59.800311,30.26996,ВППСанкт-Петербург (Пулково)СЗФО,Санкт-Петербургский,ВПП,ВПП,Санкт-Петербург (Пулково),установлен,да,нет,функционирует,круглосуточно,воздушный,не определен,грузо-пассажирский,постоянный,многосторонний,не определен,да,да,да,не применимо,не применимо,СЗФО,г. Санкт-Петербург,"централизованный пассажирский терминал: г. Санкт-Петербург, Пулковское шоссе, д. 41, литера 3А, 3В, 3Г; ЦДА «Пулково-2»: г. Санкт-Петербург, ул Стартовая, д. 17; ЦБА «Пулково-3»: г. Санкт-Петербург, Пулковское шоссе, д. 37, корп. 5, литера А",0,0,Группа В,165,Не является признаком отнесения к МТК,Не является признаком отнесения к МТК,0,288,0,288,56640,96.0,0,105120,0,105120,20673600,34999.85,683,52644,0,53327,888,59772,0,60660,688,58148,0,58836,1404,12890,0,14294,2474,23279,0,25753,164,18335,0,18499,6229727,7234851,7643041,1594250,2627631,2289849,15936.9,14298.74,17659.45,5635.59,5440.589999999999,5746.450000000001,да,да,да,да,да,нет,нет
288,54.14783,45.221158,ВППСаранскПФО,Волгоградский,ВПП,ВПП,Саранск,установлен,нет,да,После установления на постоянной основе установленным порядком не открывался. Пропуск осущетсвлялся по отдельным распоряжениям Правительства РФ,не определен,воздушный,не определен,грузо-пассажирский,работающий на нерегулярной основе,многосторонний,не определен,нет,нет,нет,не применимо,не применимо,ПФО,Республика Мордовия,не определен,0,0,Группа С,310,Не является признаком отнесения к МТК,Не является признаком отнесения к МТК,0,0,0,0,0,0.0,0,0,0,0,0,0.0,0,0,0,0,0,15,0,15,0,4,0,4,0,0,0,0,0,0,0,0,0,0,0,0,0,498,208,0,0,0,0.0,0.0,0.0,0.0,0.0,0.0,нет,нет,нет,нет,нет,нет,нет
289,51.558451,46.031133,ВППСаратов (Гагарин)ПФО,Волгоградский,ВПП,ВПП,Саратов (Гагарин),установлен,да,нет,функционирует,круглосуточно,воздушный,не определен,грузо-пассажирский,постоянный,многосторонний,не определен,нет,нет,нет,не применимо,не применимо,ПФО,Саратовская область,"Саратовская область, Саратовский муниципальный район, Вольновское муниципальное образование, с. Сабуровка, территория аэропорта «Гагарин»",0,0,Группа С,260,Не является признаком отнесения к МТК,Не является признаком отнесения к МТК,0,0,0,0,15360,0.0,0,0,0,0,5606400,0.0,0,0,0,0,0,0,0,0,14,175,0,189,30,22,0,52,15,423,0,438,9,89,0,98,0,0,18138,1661,59542,6877,0.0,54.581,52.574,206.9655,90.49700000000001,46.95,да,да,да,да,да,нет,нет
290,50.710306,61.02061,ДАППСветлыйПФО,Уральский,АПП,ДАПП,Светлый,установлен,да,нет,функционирует,круглосуточно,автомобильный,не определен,грузо-пассажирский,постоянный,двусторонний,не определен,нет,нет,нет,Республика Казахстан,Карашатау,ПФО,Оренбургская область,"Оренбургская область, Светлинский район, 11 км автогрейдера, соединяющего трассу Актюбинск - Кустанай и автомобильную дорогу Светлый - Спутник",региональная,"53 ОП РЗ 53К-2708150 Подъезд к таможенному посту ""Светлый"" от а/д Светлый - Первомайский",Группа В,170,Не является признаком отнесения к МТК,Не является признаком отнесения к МТК,0,0,0,0,0,0.0,0,0,0,0,0,0.0,5733,35,7647,13415,5425,52,7499,12976,3538,27,7732,11297,164,4,737,905,0,0,0,0,553,0,3059,3612,30636,30657,26882,2258,0,9471,0.0,0.0,0.0,0.0,0.0,0.0,да,нет,нет,нет,нет,нет,Республика Казахстан
291,61.123856,28.841682,МАППСветогорскСЗФО,Санкт-Петербургский,АПП,МАПП,Светогорск,установлен,да,да,функционирует,"круглосуточно, технологические перерывы  с 07.45 до 8.00 и с 19.45 до 20.00",автомобильный,не определен,грузо-пассажирский,постоянный,многосторонний,не определен,да,да,да,Финляндская Республика,Иматра,СЗФО,Ленинградская область,"Ленинградская область, Выборгский район, МОГП. Светогорск, автомобильная дорога Выборг-Иматра, 55 км от г. Выборга",федеральная,А-181,Группа А,51,Сухопутный,Западный,211,20,1834,2065,0,0.0,77015,7300,669410,753725,0,0.0,67416,5865,702634,775915,63499,5973,669635,739107,52163,6054,651586,709803,62192,1121,145095,208408,73667,2,716,74385,21027,256,82829,104112,1558466,1543047,1596962,423033,75012,171274,943202.0,886278.0,664845.0,738584.0,936431.0,251993.0,да,да,да,да,да,да,Финляндская Республика
292,61.118075,28.845818,ЖДПП ПУПСветогорскСЗФО,Санкт-Петербургский,ЖДПП,ЖДПП ПУП,Светогорск,установлен,да,нет,функционирует,с 08.00 до 24.00,железнодорожный,не определен,грузо-пассажирский,временный,многосторонний,упрощенный,нет,да,да,Финляндская Республика,Иматра,СЗФО,Ленинградская область,"Ленинградская область, Выборгский район, г. Светогорск, ул. Вокзальная, д.1, корп.1 лит А",0,0,Группа В,88,Сухопутный,Западный,18,0,0,18,0,0.0,6570,0,0,6570,0,0.0,2646,0,0,2646,2560,0,0,2560,2702,2,0,2704,2053,0,0,2053,1994,0,0,1994,357,0,0,357,5296,5136,5493,5508,5304,816,2351361.0,3851523.0,2651842.0,2786132.0,2675094.0,371973.0,да,да,да,да,да,нет,Финляндская Республика
293,56.3053999990225,28.4697999991477,ЖДППСебежСЗФО,Псковский,ЖДПП,ЖДПП,Себеж,установлен,да,нет,функционирует,круглосуточно,железнодорожный,не определен,грузо-пассажирский,временный,многосторонний,не определен,нет,да,да,Латвийская Республика,Зилупе,СЗФО,Псковская область,"Псковская область, г. Себеж, ул. Вокзальная, д. 1",0,0,Группа В,45,Сухопутный,Западный,24,4,0,38,0,0.0,12410,1460,0,13870,0,0.0,11526,0,0,11526,9012,744,0,9756,5566,716,0,6282,4234,164,0,4398,4310,0,0,4310,3565,0,0,3565,172886,172455,160099,36716,8803,8988,10155419.0,10625073.0,10686617.0,7321898.0,8048795.0,8288586.0,да,да,да,да,да,нет,Латвийская Республика
294,44.614917,33.526481,МППСевастопольЮФО,Крымский,МПП,МПП,Севастополь,установлен,да,нет,функционирует,круглосуточно,морской,не определен,грузо-пассажирский,постоянный,многосторонний,не определен,да,нет,да,не применимо,не применимо,ЮФО,г. Севастополь,"Морской порт Севастополь. 1. Участок СФ ЧАО «Стивидорная компания» «Авлита» (грузовой терминал — причалы N2N2 19-22) Местоположение: 299016, г. Севастополь, ул. Приморская, 2г. 2. Участок ООО «Вторстальмет» (грузовая площадка — причал N2 52). Местоположение: 299003, г. Севастополь,Симферопольское шоссе, 4. 3. Участок ГУП ГС «Севастопольский морской завод им. С. Орджоникидзе» (АО «Центр судоремонта «Звездочка») (судоремонтное предприятие — причалы №№ 89, 90а, 906, 91, 92). Местоположение: 299001, г. Севастополь, ул. Героев Севастополя, 13. 4. Участок 000 «СРЗ «Персей» (судоремонтное предприятие — причалы №№ 93-94, плавдоки Пд 51, «Равелин») . Местоположение: 299001, г. Севастополь, Лазаревский спуск, 1. 5. Участок 000 «СРЗ «Южный Севастополь» (судоремонтное предприятие — причалы №№2 1-229). Местоположение: 299014, г. Севастополь, ул.Правдьт, 24. 6. Участок 000 «Металл Сервис Группа» (грузовой комплекс — причал № 231). Местоположение: 299014, г. Севастополь, ул. Правды 30. 7. Участок 000 «Порт Лебяжий ЛТд» (грузопассажирский терминал — причал № 237; судоремонтное предприятие — причалы N2N0 235-236). Местоположение: 299014, г. Севастополь, Западный берег Камышовой бухты, 7а. 8. Участки ГУП ГС ""Севастопольский морской порт"": 8.1. грузовой район - причал No 50, Местоположение: 299003, г. Севастополь, Симферопольское шоссе, 10; 8.2. морской вокзал - причал № 143, Местоположение: 299011, г. Севастополь, Нахимова 5; 8.3. грузовой район - причал N 56, Местоположение: 299003, г. Севастополь, ул. Ангарская, 4; 8.4. грузовой терминал «Камышовая бухта» - причал №№ 210-220, Местоположение: 299014, г. Севастополь, ул. Рыбаков, 5; 8.5.нефтеналивной причал № 238, Местоположение: 299014 г. Севастополь, Западный берег Камышовой бухты, 1. 9. Участок ГУП ГС ""БСРЗ «Металлист»"". Местоположение: 299042, г. Севастополь, Балаклавская бухта, ул. Калича 2",0,0,Группа В,96,Морской,АЧБ,0,0,0,0,0,0.0,0,0,0,0,0,0.0,336,155,0,491,151,162,0,313,121,157,0,278,90,96,0,186,69,218,0,287,109,73,0,182,5393,3025,2889,1797,2481,2000,600379.3634000001,416337.336,1047352.86,203615.84,170874.053,802776.0160000001,да,да,да,да,да,да,нет
295,45.019546,33.997492,ВППСимферопольЮФО,Крымский,ВПП,ВПП,Симферополь,установлен,да,да,функционирует,круглосуточно,воздушный,не определен,грузо-пассажирский,постоянный,многосторонний,не определен,нет,нет,да,не применимо,не применимо,ЮФО,Республика Крым,"Республика Крым, г. Симферополь, пл. Аэропорта, 15",0,0,Группа А,279,Не является признаком отнесения к МТК,Не является признаком отнесения к МТК,0,0,0,0,6000,0.0,0,0,0,0,2190000,0.0,0,3,0,3,0,4,0,4,1,0,0,1,0,2,0,2,0,0,0,0,0,0,0,0,17,91,45,81,0,0,0.0,0.0,82.0,0.0,0.0,0.0,да,да,да,да,да,нет,нет
296,44.961745,34.082217,ЖДППСимферопольЮФО,Крымский,ЖДПП,ЖДПП,Симферополь,установлен,нет,нет,В связи с односторонним принятием Украинской стороной решения  о прекращении железнодорожного сообщения пропуск через госдарственную границу не осуществляется. Пункт пропуска не обустраивался,не определен,железнодорожный,не определен,пассажирский,постоянный,многосторонний,не определен,нет,нет,нет,не применимо (Херсонская обл.),не определен,ЮФО,Республика Крым,не определен,0,0,не определена,367,Не является признаком отнесения к МТК,Не является признаком отнесения к МТК,0,0,0,0,0,0.0,0,0,0,0,0,0.0,0,0,0,0,0,0,0,0,0,0,0,0,0,0,0,0,0,0,0,0,0,0,0,0,0,0,0,0,0,0,0.0,0.0,0.0,0.0,0.0,0.0,нет,нет,нет,нет,нет,нет,нет
