Unnamed: 0,latitude,longitude,ID,Филиал,Вид,Тип,Наименование пункта пропуска_y,Установлен / закрыт,Функционирует/не функционирует,84 приоритетные,Причины не функционирования,Распорядок работы,Классификация по виду международного сообщения,Дополнительная классификация по виду международного сообщения,Классификация по характеру международного сообщения,Классификация по режиму работы,Классификация по статусу,Классификация по пропуску,"Специализация: для ввоза на территорию РФ  животных, продукции животного происхождения, кормов, кормовых добавок, лекарственных средств для животных и подкарантинной продукции (подкарантинного материала, подкарантинного груза) (ПП РФ от 07.07.2011 № 557)","Специализация: для ввоза на территорию Российской  Федерации товаров, химических, биологических и радиоактивных веществ, отходов и иных грузов, представляющих опасность для человека (ПП РФ от 03.06.2011 № 442)","Специализация: для ввоза на территорию Российской Федерации пищевых продуктов, материалов и изделий (ПП РФ от 03.06.2011 № 442)",Сопредельное государство,Сопредельный пункт пропуска,Федеральный округ,Субъект РФ,Адрес,Принадлежность дороги,"Номер, название дороги",Группы АВС ,Рейтинг Приоритизации 2019 ,Направление МТК,Принадлежность к МТК,ГТС в сутки (по паспорту),ПТС в сутки (по паспорту),ЛТС в сутки (по паспорту),Всего ТС в сутки (по паспорту),Лиц в сутки (по паспорту),Грузы в сутки (по паспорту),ГТС в год (по паспорту),ПТС в год (по паспорту),ЛТС в год (по паспорту),Всего ТС в год (по паспорту),Лица в год (по паспорту),Грузы в год (по паспорту),ГТС 2017 (факт),ПТС 2017 (факт),ЛТС 2017 (факт),Всего ТС (ж.д. составы) за 2017 год (факт),ГТС 2018 (факт),ПТС 2018 (факт),ЛТС 2018 (факт),Всего ТС (ж.д. составы) за 2018 год (факт),ГТС 2019 (факт),ПТС 2019 (факт),ЛТС 2019 (факт),Всего ТС (ж.д. составы) за 2019 год (факт),ГТС 2020 (факт),ПТС 2020 (факт),ЛТС 2020 (факт),Всего ТС (ж.д. составы) за 2020 год (факт),ГТС 2021 (факт),ПТС 2021 (факт),ЛТС 2021 (факт),Всего ТС (ж.д. составы) за 2021 год (факт),ГТС 2022 (факт),ПТС 2022 (факт),ЛТС 2022 (факт),Всего ТС (ж.д. составы) за 2022 год (факт),Лица 2017 (факт),Лица 2018 (факт),Лица 2019 (факт),Лица 2020 (факт),Лица 2021 (факт),Лица 2022 (факт),"Грузы 2017, тонн (факт)","Грузы 2018, тонн (факт)","Грузы 2019, тонн (факт)","Грузы 2020, тонн (факт)","Грузы 2021, тонн (факт)","Грузы 2022, тонн (факт)",Пограничный контроль,Таможенный контроль,Санитарно-карантинный контроль,Ветеринарный контроль,Карантинный фитосанитарный контроль,Транспортный контроль,Сосед
0,49.5833,117.8167,ДАППАбагайтуйДФО,Читинский,АПП,ДАПП,Абагайтуй,установлен,нет,нет,"Пункт пропуска не обустроен, так как решение о целесообразности функционирования не принято, в том числе сопредельным государством",не определен,автомобильный,не определен,грузовой,работающий на нерегулярной основе,двусторонний,не определен,нет,нет,нет,Китайская Народная Республика,Эрка,ДФО,Забайкальский край,не определен,0,0,не определена,325,РК (сухопутный),Восток,0,0,0,0,0,0.0,0,0,0,0,0,0.0,0,0,0,0,0,0,0,0,0,0,0,0,0,0,0,0,0,0,0,0,0,0,0,0,0,0,0,0,0,0,0.0,0.0,0.0,0.0,0.0,0.0,нет,нет,нет,нет,нет,нет,Китайская Народная Республика
1,53.751561,91.400039,ВППАбаканСФО,Новосибирский,ВПП,ВПП,Абакан,установлен,да,нет,функционирует,круглосуточно,воздушный,не определен,грузо-пассажирский,постоянный,многосторонний,не определен,нет,нет,нет,не применимо,не применимо,СФО,Республика Хакасия,"Республика Хакасия, аэропорт,  г. Абакан, пр-т Дружбы Народов, 59",0,0,Группа С,289,Не является признаком отнесения к МТК,Не является признаком отнесения к МТК,1,1,0,2,9600,3.0,365,365,0,730,3504000,1095.0,8,57,0,65,18,348,0,366,74,382,0,456,85,17,0,102,147,4,0,151,266,5,0,271,9427,11500,12145,4273,1033,1670,70.822,164.698,70.96000000000001,0.0,68.908,9091.154999999999,да,да,да,да,да,нет,нет
2,43.397314,40.002072,МАППАдлерЮФО,Сочинский,АПП,МАПП,Адлер,установлен,да,да,функционирует,круглосуточно,автомобильный,пешеходный,грузо-пассажирский,постоянный,многосторонний,не определен,да,да,да,Республика Абхазия,Псоу,ЮФО,Краснодарский край,"Краснодарский край, г. Сочи, р-н Адлерский, с. Веселое,  ул. Таврическая",федеральная,А-147,Группа А,12,Западный,Север-Юг,150,100,1250,1500,28000,0.0,54750,36500,456250,547500,10220000,0.0,105498,89761,1769178,1964437,98509,93065,1916149,2107723,97161,95518,2137028,2329707,79709,52266,1398240,1530215,100691,103181,2347832,2551704,90346,82102,2388558,2561006,9635803,10022500,10826224,6454829,11392851,11972069,224437.0,174135.0,187833.0,204227.0,178396.661,337932.69,да,да,да,да,да,да,Республика Абхазия
3,43.40274645,39.99306761,ЖДППАдлерЮФО,Сочинский,ЖДПП,ЖДПП,Адлер,установлен,да,да,функционирует,круглосуточно,железнодорожный,не определен,грузо-пассажирский,постоянный,многосторонний,не определен,нет,да,да,Республика Абхазия,Псоу,ЮФО,Краснодарский край,"Краснодарский край, г. Сочи, Адлерский район, с. Весёлое железнодорожная станция «Весёлое»",0,0,Группа В,97,Западный,Север-Юг,3,3,0,6,2190,0.0,1095,1095,0,2190,799350,0.0,647,1059,0,1706,596,1046,0,1642,495,880,0,1375,279,470,0,749,460,1131,0,1591,734,1118,0,1852,336329,327887,336002,84218,329496,378987,220223.67,496640.0,430338.629,761927.5,466511.25,748754.7000000001,да,да,да,да,да,нет,Республика Абхазия
4,47.119011,39.417494,МППАзовЮФО,Ростовский,МПП,МПП,Азов,установлен,да,нет,функционирует,круглосуточно,морской,не определен,грузовой,постоянный,многосторонний,не определен,да,да,да,не применимо,не применимо,ЮФО,Ростовская область,"Ростовская область, г. Азов, в границах морского порта Азов",0,0,Группа В,73,Морской,АЧБ,1.901369863013699,0,0,1.901369863013699,0,7356.164383561644,694,0,0,694,0,2685000.0,2479,0,0,2479,3227,0,0,3227,2699,0,0,2699,2066,0,0,2066,2186,0,0,2186,1829,0,0,1829,31503,38424,33695,25428,27767,22932,4705484.0,5344792.0,4927410.0,4310688.0,4329087.0,2964654.7,да,да,да,да,да,нет,нет
5,50.3678,103.279,ДАППАйнек-ГолДФО,Читинский,АПП,ДАПП,Айнек-Гол,установлен,нет,нет,"Пункт пропуска не обустроен, так как решение о целесообразности функционирования не принято, в том числе сопредельным государством",не определен,автомобильный,не определен,грузо-пассажирский,работающий на нерегулярной основе,двусторонний,не определен,нет,нет,нет,Монголия,Бага-Илэнх-Гол,ДФО,Республика Бурятия,не определен,0,0,не определена,326,РМК,Восток,0,0,0,0,0,0.0,0,0,0,0,0,0.0,0,0,0,0,0,0,0,0,0,0,0,0,0,0,0,0,0,0,0,0,0,0,0,0,0,0,0,0,0,0,0.0,0.0,0.0,0.0,0.0,0.0,нет,нет,нет,нет,нет,нет,Монголия
6,46.7337,48.0892,ЖДППАксарайскийЮФО,Волгоградский,ЖДПП,ЖДПП,Аксарайский,установлен,да,нет,функционирует,круглосуточно,железнодорожный,не определен,грузо-пассажирский,постоянный,многосторонний,не определен,нет,нет,нет,Республика Казахстан,Ганюшкино,ЮФО,Астраханская область,"Астраханская область. Красноярский район, территория в пределах пограничных железнодорожных станций Аксарайская, Аксарайкая-2 и в соответствии с географическими координатами, утвержденными приказом Минтранса России от 20.02.2017 № 61",0,0,Группа А,63,Не является признаком отнесения к МТК,Не является признаком отнесения к МТК,0,0,0,0,0,0.0,0,0,0,0,0,0.0,8914,2583,0,11497,6919,2346,0,9265,6716,4300,0,11016,7990,1790,0,9780,7132,1509,0,8641,6529,1893,0,8422,432808,401587,391924,163223,60003,172351,0.0,0.0,0.0,0.0,0.0,0.0,да,нет,нет,нет,нет,нет,Республика Казахстан
7,50.894461,142.146687,МППАлександровск-СахалинскийДФО,Владивостокский,МПП,МПП,Александровск-Сахалинский,установлен,нет,нет,"Не функционирует по решению пограничного органа с 2009 г. Пункт пропуска не обустроен, так как решение о целесообразности функционирования не принято",не определен,морской,не определен,грузовой,постоянный,многосторонний,не определен,нет,нет,нет,не применимо,не применимо,ДФО,Сахалинская область,не определен,0,0,не определена,374,Морской,Арктика,0,0,0,0,0,0.0,0,0,0,0,0,0.0,0,0,0,0,0,0,0,0,0,0,0,0,0,0,0,0,0,0,0,0,0,0,0,0,0,0,0,0,0,0,0.0,0.0,0.0,0.0,0.0,0.0,нет,нет,нет,нет,нет,нет,нет
8,49.8833,109.0667,ДАППАлтанДФО,Читинский,АПП,ДАПП,Алтан,установлен,нет,нет,"Пункт пропуска не обустроен, так как решение о целесообразности функционирования не принято, в том числе сопредельным государством",не определен,автомобильный,не определен,грузо-пассажирский,работающий на нерегулярной основе,двусторонний,не определен,нет,нет,нет,Монголия,Агацын-Гол,ДФО,Забайкальский край,не определен,0,0,не определена,327,РМК,Восток,0,0,0,0,0,0.0,0,0,0,0,0,0.0,0,0,0,0,0,0,0,0,0,0,0,0,0,0,0,0,0,0,0,0,0,0,0,0,0,0,0,0,0,0,0.0,0.0,0.0,0.0,0.0,0.0,нет,нет,нет,нет,нет,нет,Монголия
9,47.690284,131.073245,СППАмурзетДФО,Хабаровский,СПП,СПП,Амурзет,установлен,да,нет,функционирует,"6-дневная рабочая неделя, выходной воскресенье и нерабочие праздничные дни в соответствии со ст. 112 ТК РФ, в навигационный период с 09.30 до 17.30, в период ледостава - с 9.00 до 17.30. Въезд пассажирского и грузового автотранспорта  прекращается за 30 минут до окончания работы пункта пропуска",смешанный,не определен,грузо-пассажирский,постоянный,многосторонний,не определен,нет,да,нет,Китайская Народная Республика,Лобэй,ДФО,Еврейская автономная область,"Еврейская автономная область, Октябрьский район, с. Амурзет, ул. Ленина, 91, 403 км. реки Средний Амур, 221 км. автодороги Биробиджан - Амурзет",региональная,Биробиджан-Амурзет в Ленинском и Октябрьском районах (99 ОП РЗ 99К-1),Группа В,35,РК (сухопутный),Восток,"речные суда (грузо-пассажирские) - 5, автотранспортные средства в навигационный период -25, в период ледостава - 32
",0,0,"речные суда (грузо-пассажирские) - 5, автотранспортные средства в навигационный период -25, в период ледостава - 32
",640,2000.0,"речные суда (грузо-пассажирские) - 780, автотранспортные средства в навигационный период -3 900, в период ледостава - 4160
",0,0,"речные суда (грузо-пассажирские) - 780, автотранспортные средства в навигационный период -3 900, в период ледостава - 4160
",160640,502000.0,3980,1138,0,5118,5177,728,0,5905,5300,558,0,5858,660,68,0,728,0,0,0,0,28,0,0,28,20954,18277,17608,1292,0,84,53803.0,63339.0,51474.0,7450.0,0.0,2830.2486,да,да,да,да,да,да,Китайская Народная Республика
10,64.740179,177.507531,МППАнадырьДФО,Владивостокский,МПП,МПП,Анадырь,установлен,да,нет,функционирует,"рабочие дни: понедельник - пятница с 9:00 до 18:00  (в выходные дни и вне регламента работы пункта пропуска по предварительному уведомлению (заявке) и огласованию с ГКО). Выходные дни: суббота, воскресенье (при форс-мажорных обстоятельствах круглосуточно)",морской,не определен,грузо-пассажирский,сезонный,многосторонний,не определен,нет,да,да,не применимо,не применимо,ДФО,Чукотский автономный округ,"Чукотский автономный округ, г. Анадырь, ул. Ленина, д. 73, Анадырский лиман, Берингово море",0,0,Группа С,321,Морской,Арктика,6,0,0,6,0,4000.0,546,0,0,546,0,364000.0,5,0,0,5,9,1,0,10,13,1,0,14,6,1,0,7,7,0,0,7,7,0,0,7,146,467,536,265,178,195,3.0,1237.0,5816.0,6.167,0.0,0.0,да,да,да,да,да,нет,нет
11,64.713322,177.737705,ВППАнадырь (Угольный)ДФО,Владивостокский,ВПП,ВПП,Анадырь (Угольный),установлен,да,нет,функционирует,"рабочие дни: понедельник пятница с 9:00 до 18:00 (в выходные дни и вне регламента работы пункта пропуска по предварительному уведомлению (заявке) и согласованию с ГКО). Выходные дни: суббота, воскресенье (по форс-мажорным обстоятельствам круглосуточно)",воздушный,не определен,грузо-пассажирский,работающий на нерегулярной основе,многосторонний,не определен,нет,нет,нет,не применимо,не применимо,ДФО,Чукотский автономный округ,"Чукотский АО, Анадырский р-н, п. Угольные Копи, д. 6, аэровокзальный комплекс",0,0,Группа С,301,Не является признаком отнесения к МТК,Не является признаком отнесения к МТК,0,5,0,5,900,25.0,0,0,0,0,0,0.0,5,62,0,67,1,53,0,54,1,69,0,70,0,10,0,10,3,19,0,22,0,13,0,13,325,285,494,78,80,108,0.0,2.0,12.0,10.7,10.7,0.12,да,да,да,да,да,нет,нет
12,44.897531,37.304278,МППАнапаЮФО,Сочинский,МПП,МПП,Анапа,установлен,да,нет,функционирует,круглосуточно,морской,не определен,грузо-пассажирский,постоянный,многосторонний,не определен,нет,нет,да,не применимо,не применимо,ЮФО,Краснодарский край,"Краснодарский край, г. Анапа, ул. Ленина, 1",0,0,Группа В,83,Морской,АЧБ,2,0,0,2,0,1024.657534246575,730,0,0,730,0,374000.0,114,45,0,159,10,20,0,30,12,37,0,49,5,8,0,13,0,29,0,29,43,72,0,115,3546,417,616,187,228,4164,40404.8,27629.71,15800.4,8828.362,9246.892000000002,298.37,да,да,да,да,да,нет,нет
13,45.002826,37.340337,ВППАнапа (Витязево)ЮФО,Сочинский,ВПП,ВПП,Анапа (Витязево),установлен,да,нет,функционирует,"зимний период-ежедневно с 08.00 до 20.00, летний период-ежедневно с 07.30 до 22.30",воздушный,не определен,грузо-пассажирский,работающий на нерегулярной основе,многосторонний,не определен,нет,нет,да,не применимо,не применимо,ЮФО,Краснодарский край,"Краснодарский край, г. Анапа -7, аэропорт",0,0,Группа В,199,Не является признаком отнесения к МТК,Не является признаком отнесения к МТК,0,4,0,4,480/600,10.0,0,0,0,0,0,0.0,78,662,0,740,155,320,0,475,116,434,0,550,0,335,0,335,43,485,0,528,8,67,0,75,13087,16328,24480,20307,21089,5976,137.163,31.756,172.27,502.1999999999999,1065.394,0.004,да,да,да,да,да,нет,нет
14,46.136665,33.646077,МАППАрмянскЮФО,Крымский,АПП,МАПП,Армянск,установлен,да,нет,функционирует,круглосуточно,автомобильный,не определен,грузо-пассажирский,постоянный,многосторонний,не определен,да,нет,да,не применимо (Херсонская обл.),«Контрольный пункт въезда-выезда» Каланчак,ЮФО,Республика Крым,"Республика Крым, 114 км автодороги М17 «Херсон-Джанкой-Феодосия-Керчь», МАПП Армянск",региональная,"35 ОП РЗ 35А-001
(Е-97) граница с Украиной - Джанкой - Феодосия - Керчь",Группа С,203,Сухопутный,Западный,30,30,400,460,4000,0.0,10950,10950,146000,167900,1460000,0.0,144,109,121698,121951,121,263,113177,113561,117,221,104893,105231,33,50,27352,27435,60,79,38804,38943,87536,891,199686,288113,1157566,1176248,1150990,304669,375654,705800,0.0,0.0,0.0,0.0,0.0,10902.638,да,да,да,да,да,да,нет
15,46.115953,33.702811,ЖДППАрмянскЮФО,Крымский,ЖДПП,ЖДПП,Армянск,установлен,да,нет,"В связи с односторонним принятием украинской стороной решения пропуск через государственную границу Российской Федерации временно не осуществляется с конца 2014 года. Пункт пропуска обустроен, ГКО размещены",круглосуточно,железнодорожный,не определен,грузо-пассажирский,постоянный,многосторонний,не определен,да,да,да,не применимо (Херсонская обл.),"Вадим, Херсон",ЮФО,Республика Крым,"Республика Крым, железнодорожная станция Армянск",0,0,Группа С,369,Сухопутный,Западный,0,0,0,0,0,0.0,0,0,0,0,0,0.0,0,0,0,0,0,0,0,0,0,0,0,0,0,0,0,0,0,0,0,0,32,3,0,35,0,0,0,0,0,471,0.0,0.0,0.0,0.0,0.0,0.0,да,да,да,да,да,нет,нет
16,64.528454,40.54068,МППАрхангельскСЗФО,Мурманский,МПП,МПП,Архангельск,установлен,да,нет,функционирует,круглосуточно,морской,не определен,грузо-пассажирский,постоянный,многосторонний,не определен,да,да,да,не применимо,не применимо,СЗФО,Архангельская область,"Архангельская область, Белое море, река Северная Двина, Акватория бухты Северная, залив Дежнева, о. Земля Александры, архипелага Земля Франца Иосифа",0,0,Группа В,109,Морской,Арктика,0,0,0,0,0,0.0,0,0,0,0,0,0.0,612,8,0,620,677,10,0,687,614,9,0,623,633,3,0,636,571,8,0,579,274,1,0,275,11082,13686,10965,8587,7427,3836,1726984.266,4725585.242000001,2452893.75,1834359.6609,1477400.898,782393.679,да,да,да,да,да,да,нет
17,64.595784,40.710779,ВППАрхангельск (Талаги)СЗФО,Мурманский,ВПП,ВПП,Архангельск (Талаги),установлен,да,нет,функционирует,круглосуточно,воздушный,не определен,грузо-пассажирский,постоянный,многосторонний,не определен,нет,да,нет,не применимо,не применимо,СЗФО,Архангельская область,"Архангельск, п.Талаги,  аэропорт Архангельск, д. 3, к. 3",0,0,Группа В,104,Не является признаком отнесения к МТК,Не является признаком отнесения к МТК,0,0,0,0,2880,0.0,0,0,0,0,1051200,0.0,6,537,0,543,7,467,0,474,0,423,0,423,0,9,0,9,1,179,0,180,0,16,0,16,107863,95119,84634,595,34384,2852,433.498,248.157,63.58,73.3,23.249,0.0,да,да,да,да,да,да,нет
